ISBN,JudulBuku,Penulis,Penerbit,JumlahHalaman,Genre,TahunTerbit,Stok,TanggalMasuk,Ketersediaan,Deskripsi,TotalDipinjam
9783624300005,Perjalanan Menembus Lubang Cacing,Dr. Quantum Leap,Fisika Paradoks,485,scifi,2025,10,31-01-2025,Tersedia,Ilmuwan menemukan cara melakukan perjalanan instan antar galaksi melalui lubang cacing.,0
9789843700875,Kisah Tukang Sol Sepatu Keliling,Pak Solihin Jujur,Langkah Kehidupan,170,slice of life,2022,19,08-08-2022,Tersedia,Potret kehidupan sederhana dan penuh makna dari seorang tukang sol sepatu.,0
9784838935502,Warisan Berdarah Keluarga Hartawan,Detektif Adrian,Kasus Pelik,400,drama,2024,6,14-02-2024,Tersedia,Penyelidikan pembunuhan seorang miliarder yang mengungkap konflik warisan dalam keluarganya.,0
9786669836489,Efek Plasebo dan Kekuatan Sugesti,Dr. Imajinari Sugesti,Pikiran Sehat,325,psikological,2023,11,16-06-2023,Tersedia,Bagaimana pikiran dan sugesti dapat mempengaruhi kesehatan fisik dan mental.,0
9789407045339,Cloud Native Application Development,DevOps Master,Arsitektur Modern,440,teknologi,2025,14,04-05-2025,Tersedia,Panduan membangun dan menerapkan aplikasi cloud native dengan Kubernetes dan microservices.,0
9789107714639,Ritual Pemujaan Iblis Kuno,Cultus Obscurus,Buku Terlarang,305,horor,2022,7,29-10-2022,Tersedia,Sekelompok pemuja setan mencoba membangkitkan iblis kuno dengan ritual mengerikan.,0
9782318661785,Pembalasan Mantan Agen CIA,Agent Xylo,Operasi Senyap,375,aksi,2024,17,07-03-2024,Tersedia,Seorang mantan agen CIA yang dikhianati memburu rekan-rekannya yang korup.,0
9783711074927,Kerajaan Bawah Laut Atlantis Modern,Raja Triton,Samudra Keajaiban,530,fantasi,2023,12,25-11-2023,Tersedia,Penemuan kembali peradaban Atlantis yang kini hidup berdampingan dengan teknologi canggih.,0
9784994061677,Geng Motor Paling Ngocol,Bro Zacky,Aspal Bergetar,205,comedi,2025,23,15-01-2025,Tersedia,Petualangan lucu geng motor yang anggotanya aneh-aneh dan selalu sial.,0
9784355005832,Klinik Aborsi Ilegal Dr. Maut,Nurse Pain,Suntikan Dosa,265,gore,2022,3,22-08-2022,Tersedia,Pengungkapan praktik aborsi ilegal yang dijalankan oleh dokter sadis.,0
9788476099559,Cinta Terlarang di Menara Gading,Putri Violita,Roman Istana,290,romantis,2024,18,01-03-2024,Tersedia,Kisah cinta antara seorang putri bangsawan dan pengawal pribadinya.,0
9789558839286,Terraforming Mars: Koloni Pertama,Elon Musketeer,Planet Merah Publishing,490,scifi,2023,11,19-07-2023,Tersedia,Proses terraforming planet Mars dan tantangan membangun koloni manusia pertama.,0
9784796436839,Toko Kelontong di Gang Sempit,Bu Jamilah,Cerita Tetangga,165,slice of life,2025,20,27-04-2025,Tersedia,Hiruk pikuk dan kisah-kisah unik dari sebuah toko kelontong di gang padat penduduk.,0
9785082299927,Direktur Utama yang Kejam,Mr. Tyrant Boss,Korporasi Hitam,405,drama,2022,7,13-10-2022,Tersedia,Kisah seorang karyawan yang berjuang melawan kesewenang-wenangan direktur utama perusahaan.,0
9789542372110,Mengendalikan Emosi dengan Meditasi,Guru Damai,Jiwa Tenang Press,315,psikological,2024,14,09-02-2024,Tersedia,Panduan langkah demi langkah untuk mengendalikan emosi negatif melalui teknik meditasi.,0
9784028108663,Cybersecurity untuk Era Digital,Hacker Putih,Benteng Virtual,445,teknologi,2023,12,03-09-2023,Tersedia,Ancaman siber terkini dan cara melindungi data pribadi serta sistem di era digital.,0
9787805860715,Hutan Bisikan Arwah Gentayangan,Rimba Angker,Pohon Keramat Books,310,horor,2025,9,28-01-2025,Tersedia,Sekelompok pendaki tersesat dan dihantui oleh arwah-arwah penasaran di hutan terlarang.,0
9784419707593,Tim SWAT vs Perampok Bank Profesional,Komandan Cobra,Garis Depan Laga,380,aksi,2022,16,10-06-2022,Tersedia,Adu strategi dan baku tembak antara tim SWAT dan perampok bank yang sangat terorganisir.,0
9782636491192,Pulau Para Satria Griffin Emas,Aero Wingcrest,Legenda Udara,535,fantasi,2024,10,12-05-2024,Tersedia,Petualangan mencari pulau mitos tempat para satria penunggang Griffin emas bersemayam.,0
9782262975585,Guru Matematika Paling Sableng,Pak Rumus Kacau,Kelas Ngakak,210,comedi,2023,21,29-11-2023,Tersedia,Kisah lucu seorang guru matematika dengan metode mengajar yang super aneh.,0
9780111031897,Kanibal dari Pedalaman Amazon,Dr. Explorer Gore,Ekspedisi Maut,270,gore,2025,0,16-03-2025,Kosong,Tim ekspedisi ilmiah menghadapi suku kanibal primitif di pedalaman hutan Amazon.,0
9783478323909,Takdir Cinta di Kota Paris,Amelie Dubois,Eiffel Romance,295,romantis,2022,17,01-07-2022,Tersedia,Pertemuan tak sengaja dua insan dari negara berbeda yang jatuh cinta di kota Paris.,0
9786138975462,Lubang Hitam Pemakan Galaksi,Prof. Cosmos Stellar,Teori Alam Semesta,500,scifi,2024,8,24-02-2024,Tersedia,Penelitian tentang lubang hitam supermasif dan ancamannya terhadap galaksi.,0
9782773999292,Warung Bakso Pak Kumis Joss,Kang Bakso Enak,Kuliner Nusantara,160,slice of life,2023,22,28-06-2023,Tersedia,Cerita sehari-hari dari warung bakso terkenal dan para pelanggannya yang beragam.,0
9783774413709,Pengacara Muda Melawan Koruptor Kakap,Lex Justitia,Ruang Sidang Panas,410,drama,2025,6,04-04-2025,Tersedia,Perjuangan seorang pengacara muda idealis membongkar kasus korupsi besar.,0
9785252079317,Ilusi Optik dan Tipuan Pikiran,Dr. Visionary Trick,Mata Batin Press,320,psikological,2022,11,19-12-2022,Tersedia,Bagaimana otak kita memproses informasi visual dan mudah tertipu oleh ilusi optik.,0
9783932920092,Machine Learning dengan Python Praktis,Kode Jenius,Algoritma Cerdas,450,teknologi,2024,15,09-01-2024,Tersedia,Implementasi algoritma machine learning menggunakan Python untuk berbagai kasus.,0
9786463137681,Mansion Terkutuk di Bukit Kesunyian,Edgar Allan Poe Jr.,Pena Gotik,315,horor,2023,8,11-08-2023,Tersedia,"Seorang penulis pindah ke mansion tua untuk mencari inspirasi, namun malah menemukan teror.",0
9783232529582,Pembalasan Jagoan Silat Betawi,Bang Jampang Modern,Pendekar Ibukota,385,aksi,2025,19,27-02-2025,Tersedia,Jagoan silat Betawi melawan preman-preman yang meresahkan kampungnya.,0
9789042018942,Dunia Sihir di Balik Lemari Tua,Lucy Pevensie II,Gerbang Ajaib,540,fantasi,2022,12,05-10-2022,Tersedia,Anak-anak menemukan portal ke dunia sihir melalui sebuah lemari tua di rumah nenek mereka.,0
9784071546284,Keluarga Cemara Pindah ke Mars,Abah Luar Angkasa,Planet Ceria,215,comedi,2024,20,20-05-2024,Tersedia,Keluarga Cemara versi masa depan mencoba beradaptasi hidup di koloni Planet Mars.,0
9783296916853,Operasi Amputasi Tanpa Batas,Sawbones Massacre,Trauma Medis,275,gore,2023,4,27-07-2023,Tersedia,Dokter bedah gila di medan perang melakukan amputasi brutal pada prajurit yang terluka.,0
9781945079826,Cinta Sejati Tak Kenal Usia,Oma Rosie & Opa Jack,Asmara Senja,300,romantis,2025,17,29-03-2025,Tersedia,Kisah cinta yang mekar kembali antara dua lansia di panti jompo.,0
9781475868910,Kota Cyborg di Bawah Laut,Aqua Mechanica,Atlantis Baru Press,505,scifi,2023,10,05-08-2023,Tersedia,Eksplorasi kota bawah laut canggih yang dihuni oleh manusia setengah robot.,0
9780182922628,Penjual Koran Tua dan Mimpinya,Pak Tua Cita,Koran Pagi Cerita,155,slice of life,2025,21,01-01-2025,Tersedia,Kisah inspiratif seorang penjual koran tua yang tak pernah berhenti bermimpi.,0
9785228852874,Konflik Taipan Media Nasional,Raja Berita,Jaringan Informasi Panas,415,drama,2022,6,20-06-2022,Tersedia,Persaingan brutal antara dua taipan media yang saling menjatuhkan.,0
9781450211332,Analisis Pola Tidur dan Mimpi,Dr. Somnus Dreamweaver,Istana LeLap,325,psikological,2024,12,13-04-2024,Tersedia,"Penelitian tentang berbagai pola tidur, gangguan tidur, dan interpretasi mimpi.",0
9786504178613,Pengembangan Game Edukasi Interaktif,Game Dev Junior,Pixel Pintar,455,teknologi,2023,15,26-10-2023,Tersedia,Panduan membuat game edukasi yang menarik dan interaktif untuk anak-anak.,0
9787963554105,Arwah Penunggu Jembatan Gantung,Desa Mistis Writer,Gerbang Gaib Publishing,320,horor,2025,8,16-02-2025,Tersedia,Legenda urban tentang arwah penasaran yang sering muncul di jembatan gantung tua.,0
9782544398405,Unit Elit Pembasmi Zombie,Sersan Romero,Pasukan Kiamat,390,aksi,2022,18,09-11-2022,Tersedia,Perjuangan unit elit militer bertahan hidup dan membasmi wabah zombie global.,0
9786262710823,Kerajaan Kurcaci di Gunung Emas,Thorin Stonebeard,Harta Karun Fantasi,545,fantasi,2024,11,24-01-2024,Tersedia,Petualangan mencari kerajaan kurcaci legendaris yang penuh dengan emas dan permata.,0
9788204654631,Audisi Pelawak Paling Absurd,Juri Ngakak,Panggung Geli,220,comedi,2023,20,11-07-2023,Tersedia,Kumpulan cerita lucu dari audisi pelawak yang pesertanya super aneh dan berbakat.,0
9786852482790,Eksperimen Genetik Monster Chimera,Dr. Moreaustein,Laboratorium Terlarang,280,gore,2025,0,22-04-2025,Kosong,Ilmuwan gila menciptakan monster mengerikan melalui eksperimen genetik antar spesies.,0
9787009633042,Cinta Pandangan Pertama di Perpustakaan,Buku Hati,Roman Aksara,305,romantis,2022,19,02-09-2022,Tersedia,Kisah cinta antara dua kutu buku yang bertemu dan jatuh cinta di perpustakaan kota.,0
9787815066627,Kapal Penjelajah Waktu Kembali ke Masa Dinosaurus,Dr. Chronos Rex,Mesin Waktu Publishing,510,scifi,2024,9,30-05-2024,Tersedia,Sekelompok ilmuwan melakukan perjalanan waktu ke zaman dinosaurus dan menghadapi bahaya.,0
9789067277379,Skandal Cinta Segitiga Sang Aktris Terkenal,Reporter Gosip Panas,Sorotan Selebriti,420,drama,2025,5,05-03-2025,Tersedia,Terungkapnya skandal cinta segitiga seorang aktris terkenal yang menghebohkan publik.,0
9780056866331,Sindrom Stockholm dan Ikatan Aneh,Dr. Captiva Bond,Psikologi Kriminal,330,psikological,2022,10,28-06-2022,Tersedia,Analisis psikologis fenomena Sindrom Stockholm pada korban penculikan.,0
9785313538777,Realitas Virtual dan Masa Depan Interaksi,Virtua Vision,Dimensi Baru Press,460,teknologi,2024,13,17-02-2024,Tersedia,Potensi dan perkembangan teknologi realitas virtual (VR) dalam berbagai aspek kehidupan.,0
9782738510117,Boneka Santet Kiriman Dendam,Dukun Hitam,Ilmu Gaib Maut,325,horor,2023,7,09-10-2023,Tersedia,Teror boneka santet yang dikirim untuk membalas dendam kepada sebuah keluarga.,0
9783162956924,Misi Solo Agen Pembunuh Bayaran,Shadow Assassin,Kontrak Mati,395,aksi,2025,17,19-01-2025,Tersedia,Seorang pembunuh bayaran legendaris menjalankan misi terakhirnya yang paling berbahaya.,0
9786695805765,Pohon Kehidupan di Taman Peri,Flora Evergreen,Sihir Alam Fantasi,550,fantasi,2022,12,07-12-2022,Tersedia,Pencarian Pohon Kehidupan ajaib yang dijaga oleh para peri di taman tersembunyi.,0
9787881102153,Lomba Masak Paling Kacau Sedunia,Chef Gordon Ramsay Jr.,Dapur Berantakan,225,comedi,2024,19,21-03-2024,Tersedia,Kompetisi masak amatir yang penuh dengan insiden lucu dan masakan gagal total.,0
9787943471227,Laboratorium Penyiksaan Rahasia Pemerintah,Whistleblower X,Proyek Gelap,285,gore,2023,4,30-07-2023,Tersedia,Pengungkapan fasilitas rahasia pemerintah tempat dilakukannya eksperimen penyiksaan.,0
9787429613202,Surat Cinta dari Medan Perang,Prajurit Hati Baja,Roman Frontir,310,romantis,2025,16,25-04-2025,Tersedia,Kisah cinta LDR antara seorang prajurit di medan perang dan kekasihnya di kampung halaman.,0
9785650006673,Virus Alien Mengancam Kemanusiaan,Dr. Andromeda Strain,Biohazard Global,515,scifi,2022,9,03-08-2022,Tersedia,Wabah virus mematikan dari luar angkasa menyebar dengan cepat dan mengancam eksistensi manusia.,0
9782790463610,Kedai Es Krim Penuh Kenangan,Oma Gelato Manis,Scoop Bahagia,145,slice of life,2024,23,09-05-2024,Tersedia,Setiap rasa es krim di kedai tua ini menyimpan cerita dan kenangan manis bagi pelanggannya.,0
9780108422368,Obsesi Penguntit Dunia Maya,Alex Stalkerazzi,Jejak Digital Gelap,335,psikological,2025,10,13-03-2025,Tersedia,Kisah mengerikan seorang selebgram yang hidupnya diteror oleh penguntit obsesif di dunia maya.,0
9781369912970,Pemrograman Paralel dan Komputasi Terdistribusi,Prof. Grid System,Jaringan Cepat,465,teknologi,2022,13,21-07-2022,Tersedia,Konsep dan implementasi pemrograman paralel untuk meningkatkan kinerja komputasi.,0
9788969426018,Makhluk Penghisap Jiwa dari Dimensi Lain,Eldritch Horror,Portal Kegelapan,330,horor,2024,8,06-01-2024,Tersedia,Sebuah portal terbuka dan melepaskan makhluk mengerikan yang memangsa jiwa manusia.,0
9787775560095,Tim Balap Liar Penakluk Jalanan,Racer King,Aspal Terbakar,399,aksi,2023,17,30-08-2023,Tersedia,Persaingan sengit antar tim balap liar di jalanan kota yang berbahaya.,0
9782699120488,Ramuan Cinta Sang Penyihir Desa,Nenek Sihir Asmara,Mantra Hati,555,fantasi,2025,11,16-04-2025,Tersedia,Penyihir tua membuat ramuan cinta paling ampuh yang menyebabkan kekacauan di desanya.,0
9780933654560,Kumpulan Pantun Jenaka Bang Jampang,Bang Jampang Lucu,Budaya Tawa,230,comedi,2022,20,19-10-2022,Tersedia,Kumpulan pantun lucu dan menghibur khas Betawi dari Bang Jampang.,0
9788564884296,Rumah Sakit Terbengkalai Penuh Organ Manusia,Dr. Butcherstein,Koleksi Mengerikan,290,gore,2024,0,26-02-2024,Kosong,Penemuan mengerikan di rumah sakit jiwa tua yang ternyata menjadi tempat penyimpanan organ ilegal.,0
9787016055970,Janji Setia di Bawah Langit Swiss,Heidi Alpine,Roman Pegunungan,315,romantis,2023,16,12-06-2023,Tersedia,Kisah cinta romantis dengan latar belakang pemandangan indah pegunungan Alpen Swiss.,0
9783445272973,Peradaban Manusia di Planet Tiruan Bumi,Project Genesis,Terra Nova Books,520,scifi,2025,9,27-01-2025,Tersedia,Eksperimen rahasia menciptakan planet tiruan Bumi dan peradaban baru di atasnya.,0
9789839317266,Kisah Pedagang Asongan di Lampu Merah,Pak Ujang Sabar,Jalanan Ibukota,140,slice of life,2022,24,09-08-2022,Tersedia,Perjuangan hidup dan cerita-cerita unik dari seorang pedagang asongan.,0
9787592024395,Membaca Karakter Lewat Tulisan Tangan,Grafolog Analisa,Pena Jiwa Press,340,psikological,2023,11,02-11-2023,Tersedia,Panduan menganalisis kepribadian dan karakter seseorang melalui tulisan tangannya.,0
9788882385298,Hotel Berhantu di Puncak Gunung Salju,Penjaga Penginapan Arwah,Kamar Dingin,335,horor,2022,7,27-06-2022,Tersedia,Para pendaki terjebak badai salju dan terpaksa menginap di hotel tua yang berhantu.,0
9786472070580,Pasukan Penjinak Bom Paling Berani,Sersan Detonator,Zona Ledakan,405,aksi,2024,18,07-04-2024,Tersedia,Kisah heroik tim penjinak bom dalam menghadapi ancaman teror di kota besar.,0
9781366723426,Negeri Peri Bunga Matahari,Putri Lumia,Taman Ajaib Fantasi,560,fantasi,2023,10,14-09-2023,Tersedia,Petualangan di negeri peri yang semua tanamannya terbuat dari cahaya dan permata.,0
9788113976123,Kumpulan Cerpen Komedi Salah Paham,Trio Wagu,Ngakak Publishing,235,comedi,2025,19,05-02-2025,Tersedia,Cerita-cerita pendek lucu yang timbul akibat kesalahpahaman konyol.,0
9787476286884,Pabrik Sosis Manusia Tersembunyi,Chef Hannibal Jr.,Resep Daging Rahasia,295,gore,2022,5,15-12-2022,Tersedia,Investigasi hilangnya orang-orang yang mengarah pada sebuah pabrik sosis misterius.,0
9789334135821,Cinta Tak Terduga di Pulau Tropis,Kapten Hati Biru,Roman Samudra,320,romantis,2024,15,12-01-2024,Tersedia,Seorang wanita karir terdampar di pulau terpencil dan jatuh cinta pada penduduk lokal.,0
9786360993720,Serangan Armada Cyborg dari Nebula Andromeda,Laksamana Cygnus,Perang Bintang X,525,scifi,2023,8,25-07-2023,Tersedia,Perang dahsyat melawan armada cyborg dari galaksi lain yang ingin menguasai Bimasakti.,0
9788535516643,Galeri Foto Kehidupan Kota Tua,Fotografer Jalanan,Lensa Nostalgia,135,slice of life,2025,25,18-05-2025,Tersedia,Kumpulan foto dan cerita di baliknya yang menangkap esensi kehidupan di sebuah kota tua.,0
9782166028689,Intrik Perebutan Warisan Perusahaan Raksasa,CEO Bayangan,Bisnis Berdarah,435,drama,2022,6,01-09-2022,Tersedia,Saling sikut dan intrik kotor dalam perebutan posisi CEO di perusahaan multinasional.,0
9781154132241,Psikologi Massa dan Perilaku Kerumunan,Dr. Mob Mentality,Analisis Sosial,345,psikological,2024,12,20-02-2024,Tersedia,Studi tentang bagaimana individu berperilaku berbeda ketika berada dalam kerumunan besar.,0
9781285188012,Keamanan Data di Era Komputasi Kuantum,Crypto Quantum,Enkripsi Masa Depan,475,teknologi,2023,10,01-10-2023,Tersedia,Tantangan dan solusi keamanan data menghadapi kemajuan komputer kuantum.,0
9786197710358,Kisah Nyata Pesugihan Gunung Kawi,Pencari Berkah Sesat,Ritual Gelap Jawa,340,horor,2025,9,29-04-2025,Tersedia,Pengakuan mantan pelaku pesugihan dan kengerian yang dialaminya di Gunung Kawi.,0
9788747300817,Pasukan Siber Penjaga Kedaulatan,Kapten Enkripsi,Benteng Digital Negara,410,aksi,2023,18,08-06-2023,Tersedia,Tim peretas etis pemerintah melawan serangan siber yang mengancam negara.,0
9788577340857,Dunia Paralel di Balik Cermin Ajaib,Alice Wonderer,Refleksi Fantastika,565,fantasi,2025,11,10-02-2025,Tersedia,Seorang gadis menemukan dunia paralel yang penuh keajaiban dan bahaya di balik cermin tua.,0
9784087353705,Kumpulan Cerita Salah Tingkah Pak Lurah,Lurah Gokil Abis,Desa Tawa Ceria,240,comedi,2022,20,21-11-2022,Tersedia,Kelakuan dan keputusan-keputusan aneh Pak Lurah yang selalu mengundang tawa warga.,0
9789666715574,Koleksi Kepala Manusia Sang Antropolog Gila,Prof. Cranium Collector,Museum Tengkorak,300,gore,2024,0,17-01-2024,Kosong,Antropolog terkenal ternyata memiliki koleksi kepala manusia dari berbagai suku terasing.,0
9787436651080,Cinta Bersemi di Festival Musik Indie,Nada Senja,Melodi Alternatif,325,romantis,2023,16,04-08-2023,Tersedia,Dua pecinta musik indie bertemu dan jatuh cinta di tengah kemeriahan festival musik.,0
9787879109555,Kolonisasi Sabuk Asteroid Kuiper,Pioneer Stardust,Perbatasan Angkasa,530,scifi,2025,9,06-04-2025,Tersedia,Perjuangan manusia menambang dan membangun koloni di sabuk asteroid jauh dari Bumi.,0
9785607864888,Gerobak Bubur Ayam Legendaris,Bang Aceng Bubur,Resep Warisan Pagi,130,slice of life,2022,26,11-07-2022,Tersedia,Kisah inspiratif seorang penjual bubur ayam yang gerobaknya menjadi ikon kuliner.,0
9784904847403,Skandal Suap Proyek Infrastruktur,Inspektur Integritas,Jejak Koruptor,440,drama,2024,6,29-05-2024,Tersedia,Investigasi mendalam kasus suap besar yang melibatkan kontraktor dan pejabat pemerintah.,0
9782218094254,Memori Terhapus Sang Agen Amnesia,Subjek Omega,Lab Eksperimen Gelap,350,psikological,2023,12,26-09-2023,Tersedia,Seorang agen rahasia kehilangan ingatannya dan harus mencari tahu siapa dirinya sebenarnya.,0
9785735508095,Pengantar Rekayasa Perangkat Lunak Modern,Prof. Kode Bersih,Arsitektur Aplikasi,480,teknologi,2025,14,02-01-2025,Tersedia,Prinsip dan praktik terbaik dalam pengembangan perangkat lunak skala besar.,0
9788362507030,Misteri Pulau Kanibal Tak Berpenghuni,Kapten Nemo Jr.,Ekspedisi Laut Dalam,345,horor,2022,7,09-12-2022,Tersedia,Tim peneliti terdampar di pulau terpencil yang ternyata dihuni suku kanibal mengerikan.,0
9783993652446,Agen Intelijen Melawan Pembunuh Internasional,Mark Spectre,Misi Global Rahasia,415,aksi,2024,17,24-03-2024,Tersedia,Agen rahasia terbaik dunia memburu pembunuh bayaran licin yang targetnya para pemimpin dunia.,0
9784655171165,Kota Terapung Para Penyihir Laut,Aquaria Mistwalker,Sihir Samudra,570,fantasi,2023,10,15-06-2023,Tersedia,Penemuan kota terapung ajaib yang dihuni oleh para penyihir penguasa lautan.,0
9788572627210,Kumpulan Dongeng Salah Tafsir,Pencerita Ngawur,Logika Terbalik,245,comedi,2025,19,23-02-2025,Tersedia,Dongeng-dongeng klasik yang diceritakan ulang dengan interpretasi yang super konyol.,0
9780698346496,Kamar Mayat Rumah Sakit Angker,Juru Autopsi Malam,Catatan Forensik Seram,305,gore,2022,5,07-10-2022,Tersedia,Kejadian-kejadian aneh dan mengerikan yang dialami petugas kamar mayat di rumah sakit tua.,0
9786625010304,Cinta Pandangan Kedua di Reuni SMA,Nostalgia Asmara,Album Kenangan Manis,330,romantis,2024,15,19-04-2024,Tersedia,Dua teman lama bertemu kembali di reuni SMA dan menemukan cinta yang dulu terpendam.,0
9783674033040,Perang Melawan Kecerdasan Buatan Jahat,"Neo ""The One"" Cyber",Matriks Pemberontak,535,scifi,2023,8,11-11-2023,Tersedia,Masa depan di mana umat manusia berperang melawan AI super cerdas yang ingin menguasai dunia.,0
9787770550185,Bengkel Tambal Ban Pak Sabar,Pak Ban Kempes,Cerita Pinggir Jalan,125,slice of life,2025,27,08-03-2025,Tersedia,Kisah-kisah inspiratif dan lucu dari interaksi Pak Sabar dengan para pelanggannya.,0
9784339250419,Direbutnya Perusahaan Keluarga oleh Orang Dalam,Pewaris Terbuang,Konflik Korporasi,445,drama,2022,6,16-08-2022,Tersedia,Anak pemilik perusahaan harus berjuang merebut kembali perusahaannya dari pengkhianatan orang kepercayaan ayahnya.,0
9788551438945,Hipnoterapi Mengungkap Trauma Terpendam,Dr. Subliminal Healer,Pikiran Bawah Sadar,355,psikological,2024,11,31-01-2024,Tersedia,Proses hipnoterapi yang membantu pasien mengungkap dan menyembuhkan trauma masa kecil.,0
9780331018719,Teknologi Drone Pengawasan dan Pengiriman,Pilot Tanpa Awak,Langit Cerdas,485,teknologi,2023,13,03-07-2023,Tersedia,Pemanfaatan drone untuk berbagai keperluan mulai dari pengawasan hingga pengiriman barang.,0
9782953757826,Pondok Pesantren di Tengah Hutan Angker,Ustadz Penakluk Jin,Kisah Santri Gaib,350,horor,2025,9,27-05-2025,Tersedia,Para santri dan ustadz dihadapkan pada gangguan makhluk halus dari hutan sekitar pesantren.,0
9782450227903,Misi Penyelamatan Sandera di Kapal Pesiar,Tim Alpha Seal,Laut Merah Membara,420,aksi,2022,18,24-09-2022,Tersedia,Pasukan khusus menyerbu kapal pesiar yang dibajak teroris untuk menyelamatkan sandera.,0
9789755909042,Pegasus Bersayap Pelangi Penjaga Surga,Celestia Skyhoof,Mitologi Kayangan,575,fantasi,2024,10,05-02-2024,Tersedia,Legenda Pegasus ajaib yang menjaga gerbang surga dari kekuatan jahat.,0
9781410008284,Rumah Pemotongan Hewan Ilegal Penuh Kengerian,Slasher Chainsaw,Daging Segar Berdarah,310,gore,2025,4,10-01-2025,Tersedia,Investigasi jurnalis mengungkap rumah pemotongan hewan ilegal yang juga memproses manusia.,0
9789812981411,Cinta Bertepuk Sebelah Tangan di Stasiun Kereta,Penunggu Peron Hati,Rel Asmara Patah,335,romantis,2022,17,27-07-2022,Tersedia,Kisah pilu cinta tak terbalas yang bersemi dan berakhir di stasiun kereta.,0
9784821800589,Dunia Virtual Utopia atau Distopia?,Avatar Coder X,Realitas Digital Baru,540,scifi,2024,9,14-03-2024,Tersedia,Eksplorasi masa depan di mana manusia lebih banyak hidup di dunia virtual yang sempurna namun penuh kontrol.,0
9782785665004,Kafe Kucing Tempat Curhat,Mpus Penyayang,Meong Meong Stories,120,slice of life,2023,28,01-09-2023,Tersedia,Kisah-kisah mengharukan dari para pengunjung kafe kucing yang mencari teman curhat.,0
9789173246031,Pembalasan Dendam Sang Pewaris Takhta yang Terbuang,Pangeran Kegelapan,Saga Balas Dendam,450,drama,2025,7,02-05-2025,Tersedia,Seorang pangeran yang diasingkan kembali untuk merebut takhta dan membalas dendam.,0
9789162400027,Teror Psikopat di Kota Kecil,Detektif Waspada,Jejak Kriminal Kelam,360,psikological,2022,12,07-06-2022,Tersedia,Serangkaian pembunuhan misterius oleh psikopat cerdas meneror sebuah kota kecil yang damai.,0
9786239324059,Sekolah Asrama Putri Berhantu di Tepi Hutan,Siswi Penakut,Malam Jeritan,355,horor,2023,8,25-10-2023,Tersedia,Para siswi di asrama terpencil mengalami gangguan dari arwah-arwah siswi yang meninggal tragis.,0
9782895678008,Pemburu Bayaran Melawan Kartel Senjata Ilegal,Maximus Steel,Operasi Global Hitam,425,aksi,2025,18,27-03-2025,Tersedia,Pemburu bayaran internasional disewa untuk menghancurkan jaringan kartel senjata ilegal.,0
9783157150590,Negeri Para Goblin Penambang Permata,Grizelda Rockbiter,Tambang Fantasi Ajaib,580,fantasi,2022,11,13-08-2022,Tersedia,Petualangan di kerajaan bawah tanah para goblin yang menambang permata berkekuatan sihir.,0
9784055838011,Kumpulan Teka-Teki Super Ngawur Pak Bendot,Pak Bendot Bingung,Logika Miring,255,comedi,2024,22,05-01-2024,Tersedia,Teka-teki lucu dan menjebak dari Pak Bendot yang jawabannya selalu di luar nalar.,0
9786832988739,Kanibalisme di Kapal Terdampar,Kapten Rakus,Samudra Kelaparan,315,gore,2023,0,18-07-2023,Kosong,Para penumpang kapal yang terdampar di pulau kosong terpaksa melakukan kanibalisme untuk bertahan hidup.,0
9787059068116,Cinta Rahasia Sang Penulis Novel Misteri,Agatha Christie KW,Tinta Asmara Tersembunyi,340,romantis,2025,16,11-04-2025,Tersedia,Seorang penulis novel misteri terkenal diam-diam jatuh cinta pada detektif yang menginspirasi karakternya.,0
9788220257862,Perjalanan Antar Dimensi Melalui Gerbang Kosmik,Dr. Vortex Gate,Teori Multiverse,545,scifi,2022,10,30-09-2022,Tersedia,Penemuan gerbang kosmik yang memungkinkan perjalanan ke alam semesta paralel dengan hukum fisika berbeda.,0
9784247309896,Bapak Satpam Kompleks dan Kucingnya,Pak Jaga Setia,Harmoni Perumahan,115,slice of life,2024,29,16-05-2024,Tersedia,Keseharian seorang bapak satpam kompleks yang ramah dan kucing kesayangannya yang selalu menemani.,0
9786913544595,Pengkhianatan di Puncak Kekuasaan Politik,Senator Licik,Arena Intrik Senayan,455,drama,2023,7,23-06-2023,Tersedia,Kisah pengkhianatan dan perebutan kekuasaan di antara para elit politik.,0
9780086402742,Mimpi Bertemu Arwah Leluhur,Indigo Visioner,Komunikasi Gaib,365,psikological,2025,12,03-02-2025,Tersedia,Pengalaman seorang indigo yang sering berkomunikasi dengan arwah leluhur melalui mimpi.,0
9784851226354,Kriptografi dan Keamanan Jaringan Komputer,Ahli Sandi Digital,Kode Rahasia Siber,495,teknologi,2022,14,07-11-2022,Tersedia,Teknik-teknik kriptografi modern untuk mengamankan data dan jaringan komputer dari serangan.,0
9781306624614,Legenda Siluman Buaya Putih Penjaga Sungai,Ki Jagawana,Mitos Air Keruh,360,horor,2024,8,02-03-2024,Tersedia,Cerita rakyat tentang siluman buaya putih yang menjaga sebuah sungai angker dan meminta tumbal.,0
9786307360534,Tim Penyelamat Bencana Alam Lintas Negara,Relawan Heroik,Operasi Kemanusiaan,430,aksi,2023,19,26-08-2023,Tersedia,Aksi heroik tim SAR internasional dalam menyelamatkan korban bencana alam di berbagai negara.,0
9782529310134,Akademi Ksatria Penunggang Naga Langit,Sir Reginald Drake,Skuadron Api Fantasi,585,fantasi,2025,11,20-01-2025,Tersedia,Pelatihan para ksatria muda untuk menjadi penunggang naga legendaris.,0
